{
	"aligned_image_path": "/data/out/form-003_aligned.png",
	"transform_type": "homography",
	"transform_matrix": [
		[
			1.0004,
			0.0003,
			-1.27
		],
		[
			-0.0002,
			0.9998,
			0.84
		],
		[
			0.0,
			0.0,
			1.0
		]
	],
	"markers_detected": 4,
	"markers_expected": 4,
	"marker_details": [
		{
			"id": "marker_001",
			"detected": true,
			"detected_position": {
				"x": 158.6,
				"y": 68.2
			},
			"expected_position": {
				"x": 159,
				"y": 69
			},
			"offset_px": 0.89,
			"confidence": 0.7801
		},
		{
			"id": "marker_002",
			"detected": true,
			"detected_position": {
				"x": 2418.3,
				"y": 67.5
			},
			"expected_position": {
				"x": 2418,
				"y": 68
			},
			"offset_px": 0.58,
			"confidence": 0.7926
		},
		{
			"id": "marker_003",
			"detected": true,
			"detected_position": {
				"x": 153.4,
				"y": 3406.4
			},
			"expected_position": {
				"x": 154,
				"y": 3407
			},
			"offset_px": 0.85,
			"confidence": 0.7713
		},
		{
			"id": "marker_004",
			"detected": true,
			"detected_position": {
				"x": 2420.7,
				"y": 3405.6
			},
			"expected_position": {
				"x": 2421,
				"y": 3406
			},
			"offset_px": 0.5,
			"confidence": 0.7768
		}
	],
	"reprojection_error": 0.41,
	"alignment_quality": "excellent",
	"recognition_zones": [
		{
			"zone_id": "row_002",
			"detected": true,
			"text": "7",
			"confidence": 0.9993,
			"recognition_type": "handwritten",
			"engine": "trocr",
			"filter_applied": "dotted_box"
		}
	]
}
